{
  "as_of_date": "2026-08-13",
  "candidate_preferences": {
    "currency": "unknown",
    "money_budget": "limited",
    "purchase_authorized": false,
    "weekly_time_budget": "3_to_5_hours"
  },
  "coach_decision": {
    "decision": "hold_until_preferences_confirmed",
    "draft_only": true,
    "no_external_action": true,
    "rationale": "Prioritize candidate-owned proof before paid learning while preserving private review gates.",
    "review_gate": "No external action; review the exact option, candidate preferences, and publication boundary before proceeding."
  },
  "learning_decisions": [
    {
      "confidence": "medium",
      "decision": "consider",
      "decision_basis": "recurring vacancy evidence is bounded and the next review gate remains private",
      "draft_only": true,
      "expected_signal": "bounded hypothesis a bounded proof artifact may make the gap easier to discuss without predicting hiring outcomes",
      "frequency_display": "4/4",
      "frequency_occurrences": 4,
      "frequency_sample_size": 4,
      "gap_signal": "terraform_iac",
      "gap_type": "learnable_gap",
      "next_action_gate": "no external action; confirm the exact candidate action and target before proceeding",
      "no_external_action": true,
      "opportunity_cost": "time diverted from applications, interview preparation, and higher-signal candidate-owned proof",
      "option_id": "LO-101",
      "option_type": "free_resource",
      "outcome_boundary": "not_an_interview_offer_salary_or_roi_prediction",
      "proof_needed": "Synthetic notes",
      "rank": 1
    },
    {
      "confidence": "medium",
      "decision": "consider",
      "decision_basis": "official provider source and exact recurring vacancy evidence; review budget and authorization before enrollment",
      "draft_only": true,
      "expected_signal": "bounded hypothesis a bounded proof artifact may make the gap easier to discuss without predicting hiring outcomes",
      "frequency_display": "4/4",
      "frequency_occurrences": 4,
      "frequency_sample_size": 4,
      "gap_signal": "kubernetes",
      "gap_type": "learnable_gap",
      "next_action_gate": "no external action; confirm the exact candidate action and target before proceeding",
      "no_external_action": true,
      "opportunity_cost": "time diverted from applications, interview preparation, and higher-signal candidate-owned proof",
      "option_id": "LO-102",
      "option_type": "course",
      "outcome_boundary": "not_an_interview_offer_salary_or_roi_prediction",
      "proof_needed": "Synthetic private project",
      "rank": 2
    },
    {
      "confidence": "medium",
      "decision": "consider",
      "decision_basis": "official provider source and exact recurring vacancy evidence; review budget and authorization before enrollment",
      "draft_only": true,
      "expected_signal": "bounded hypothesis a bounded proof artifact may make the gap easier to discuss without predicting hiring outcomes",
      "frequency_display": "4/4",
      "frequency_occurrences": 4,
      "frequency_sample_size": 4,
      "gap_signal": "observability",
      "gap_type": "learnable_gap",
      "next_action_gate": "no external action; confirm the exact candidate action and target before proceeding",
      "no_external_action": true,
      "opportunity_cost": "time diverted from applications, interview preparation, and higher-signal candidate-owned proof",
      "option_id": "LO-103",
      "option_type": "course",
      "outcome_boundary": "not_an_interview_offer_salary_or_roi_prediction",
      "proof_needed": "Synthetic exercises",
      "rank": 3
    }
  ],
  "learning_options": [
    {
      "action_gate": {
        "confidentiality_review": "required",
        "customer_data_review": "required",
        "exact_authorization_required": true,
        "external_action_authorized": false,
        "ownership_review": "not_applicable",
        "publication_authorized": false,
        "rights_holder_review": "not_applicable",
        "secrets_review": "required"
      },
      "availability": "unknown",
      "currency": "not_applicable",
      "current_cost": "not_applicable",
      "duration": "unknown",
      "duration_basis": "provider_duration_unknown",
      "gap_signal": "terraform_iac",
      "geography": "unknown",
      "maintenance": "not_applicable",
      "option": "Synthetic observability guide",
      "option_id": "LO-101",
      "option_type": "free_resource",
      "prerequisite": "unknown",
      "proof_artifact": "Synthetic notes",
      "provider": "Fixture Learning Platform",
      "renewal": "not_applicable",
      "role": "unknown",
      "seniority": "unknown",
      "source_date": "2026-08-13",
      "source_state": "synthetic",
      "source_title": "Synthetic guide",
      "tax": "not_applicable",
      "unknowns": [
        "synthetic fixture"
      ],
      "url": "https://example.com/fixtures/guide"
    },
    {
      "action_gate": {
        "confidentiality_review": "required",
        "customer_data_review": "required",
        "exact_authorization_required": true,
        "external_action_authorized": false,
        "ownership_review": "required",
        "publication_authorized": false,
        "rights_holder_review": "required",
        "secrets_review": "required"
      },
      "availability": "unknown",
      "currency": "unknown",
      "current_cost": "unknown",
      "duration": "5 private days",
      "duration_basis": "provider_duration_unknown",
      "gap_signal": "kubernetes",
      "geography": "unknown",
      "maintenance": "not_applicable",
      "option": "Synthetic observability project",
      "option_id": "LO-102",
      "option_type": "course",
      "prerequisite": "unknown",
      "proof_artifact": "Synthetic private project",
      "provider": "Fixture University",
      "renewal": "not_applicable",
      "role": "unknown",
      "seniority": "unknown",
      "source_date": "2026-08-13",
      "source_state": "synthetic",
      "source_title": "Synthetic project",
      "tax": "unknown",
      "unknowns": [
        "synthetic fixture"
      ],
      "url": "https://example.com/fixtures/observability-project"
    },
    {
      "action_gate": {
        "confidentiality_review": "required",
        "customer_data_review": "required",
        "exact_authorization_required": true,
        "external_action_authorized": false,
        "ownership_review": "not_applicable",
        "publication_authorized": false,
        "rights_holder_review": "not_applicable",
        "secrets_review": "required"
      },
      "availability": "unknown",
      "currency": "unknown",
      "current_cost": "unknown",
      "duration": "unknown",
      "duration_basis": "provider_duration_unknown",
      "gap_signal": "observability",
      "geography": "unknown",
      "maintenance": "unknown",
      "option": "Synthetic automation course",
      "option_id": "LO-103",
      "option_type": "course",
      "prerequisite": "unknown",
      "proof_artifact": "Synthetic exercises",
      "provider": "Fixture University",
      "renewal": "unknown",
      "role": "unknown",
      "seniority": "unknown",
      "source_date": "2026-08-13",
      "source_state": "synthetic",
      "source_title": "Synthetic course",
      "tax": "unknown",
      "unknowns": [
        "synthetic fixture"
      ],
      "url": "https://example.com/fixtures/automation-course"
    },
    {
      "action_gate": {
        "confidentiality_review": "not_applicable",
        "customer_data_review": "not_applicable",
        "exact_authorization_required": true,
        "external_action_authorized": false,
        "ownership_review": "not_applicable",
        "publication_authorized": false,
        "rights_holder_review": "not_applicable",
        "secrets_review": "not_applicable"
      },
      "availability": "not_applicable",
      "currency": "not_applicable",
      "current_cost": "not_applicable",
      "duration": "not_applicable",
      "duration_basis": "provider_duration_unknown",
      "gap_signal": "observability",
      "geography": "not_applicable",
      "maintenance": "not_applicable",
      "option": "Synthetic defer",
      "option_id": "LO-104",
      "option_type": "do_nothing_now",
      "prerequisite": "not_applicable",
      "proof_artifact": "Synthetic defer record",
      "provider": "none",
      "renewal": "not_applicable",
      "role": "not_applicable",
      "seniority": "not_applicable",
      "source_date": "2026-08-13",
      "source_state": "synthetic",
      "source_title": "Synthetic defer decision",
      "tax": "not_applicable",
      "unknowns": [],
      "url": null
    }
  ],
  "learning_state": "evaluated",
  "locale": "en",
  "matrix_rows": [
    {
      "cells": [
        {
          "required": true,
          "vacancy_id": "V-001"
        },
        {
          "required": true,
          "vacancy_id": "V-002"
        },
        {
          "required": true,
          "vacancy_id": "V-003"
        },
        {
          "required": true,
          "vacancy_id": "V-004"
        }
      ],
      "evidence_ids": [
        "E-001"
      ],
      "signal": "terraform_iac",
      "support_state": "explicit_gap"
    },
    {
      "cells": [
        {
          "required": true,
          "vacancy_id": "V-001"
        },
        {
          "required": true,
          "vacancy_id": "V-002"
        },
        {
          "required": true,
          "vacancy_id": "V-003"
        },
        {
          "required": true,
          "vacancy_id": "V-004"
        }
      ],
      "evidence_ids": [
        "E-002"
      ],
      "signal": "kubernetes",
      "support_state": "explicit_gap"
    },
    {
      "cells": [
        {
          "required": true,
          "vacancy_id": "V-001"
        },
        {
          "required": true,
          "vacancy_id": "V-002"
        },
        {
          "required": true,
          "vacancy_id": "V-003"